{
  "$schema": "https://json-schema.org/draft/2020-12/schema",
  "title": "Mission Author simulator semantic catalog pack",
  "type": "object",
  "required": [
    "format",
    "id",
    "version",
    "catalogs"
  ],
  "additionalProperties": false,
  "properties": {
    "format": {
      "const": "mission-author-catalogs-1"
    },
    "id": {
      "type": "string",
      "minLength": 1
    },
    "version": {
      "type": "integer",
      "minimum": 1
    },
    "catalogs": {
      "type": "object",
      "required": [
        "MISSION_HOOK_CATALOG",
        "MISSION_PATTERN_CATALOG",
        "STAGE_PURPOSE_CATALOG",
        "ENVIRONMENT_ROLE_CATALOG",
        "MISSION_ROLE_CATALOG",
        "GENERIC_NPC_ROLE_CATALOG",
        "INSTANCE_ROLE_CATALOG",
        "INCIDENT_CATALOG",
        "EVENT_CATALOG",
        "FACT_ROLE_CATALOG",
        "CLUE_SOURCE_CATALOG",
        "INTERACTION_INTENT_CATALOG",
        "COMPLICATION_CATALOG",
        "OPTIONAL_OPPORTUNITY_CATALOG",
        "RECOVERY_ROLE_CATALOG",
        "CONSEQUENCE_TYPE_CATALOG",
        "ACT_AVAILABILITY"
      ],
      "additionalProperties": false,
      "properties": {
        "MISSION_HOOK_CATALOG": {
          "type": "object",
          "required": [
            "version",
            "rows"
          ],
          "additionalProperties": false,
          "properties": {
            "version": {
              "type": "integer",
              "minimum": 1
            },
            "rows": {
              "type": "array",
              "items": {
                "$ref": "#/$defs/row"
              }
            }
          }
        },
        "MISSION_PATTERN_CATALOG": {
          "type": "object",
          "required": [
            "version",
            "rows"
          ],
          "additionalProperties": false,
          "properties": {
            "version": {
              "type": "integer",
              "minimum": 1
            },
            "rows": {
              "type": "array",
              "items": {
                "$ref": "#/$defs/row"
              }
            }
          }
        },
        "STAGE_PURPOSE_CATALOG": {
          "type": "object",
          "required": [
            "version",
            "rows"
          ],
          "additionalProperties": false,
          "properties": {
            "version": {
              "type": "integer",
              "minimum": 1
            },
            "rows": {
              "type": "array",
              "items": {
                "$ref": "#/$defs/row"
              }
            }
          }
        },
        "ENVIRONMENT_ROLE_CATALOG": {
          "type": "object",
          "required": [
            "version",
            "rows"
          ],
          "additionalProperties": false,
          "properties": {
            "version": {
              "type": "integer",
              "minimum": 1
            },
            "rows": {
              "type": "array",
              "items": {
                "$ref": "#/$defs/row"
              }
            }
          }
        },
        "MISSION_ROLE_CATALOG": {
          "type": "object",
          "required": [
            "version",
            "rows"
          ],
          "additionalProperties": false,
          "properties": {
            "version": {
              "type": "integer",
              "minimum": 1
            },
            "rows": {
              "type": "array",
              "items": {
                "$ref": "#/$defs/row"
              }
            }
          }
        },
        "GENERIC_NPC_ROLE_CATALOG": {
          "type": "object",
          "required": [
            "version",
            "rows"
          ],
          "additionalProperties": false,
          "properties": {
            "version": {
              "type": "integer",
              "minimum": 1
            },
            "rows": {
              "type": "array",
              "items": {
                "$ref": "#/$defs/row"
              }
            }
          }
        },
        "INSTANCE_ROLE_CATALOG": {
          "type": "object",
          "required": [
            "version",
            "rows"
          ],
          "additionalProperties": false,
          "properties": {
            "version": {
              "type": "integer",
              "minimum": 1
            },
            "rows": {
              "type": "array",
              "items": {
                "$ref": "#/$defs/row"
              }
            }
          }
        },
        "INCIDENT_CATALOG": {
          "type": "object",
          "required": [
            "version",
            "rows"
          ],
          "additionalProperties": false,
          "properties": {
            "version": {
              "type": "integer",
              "minimum": 1
            },
            "rows": {
              "type": "array",
              "items": {
                "$ref": "#/$defs/row"
              }
            }
          }
        },
        "EVENT_CATALOG": {
          "type": "object",
          "required": [
            "version",
            "rows"
          ],
          "additionalProperties": false,
          "properties": {
            "version": {
              "type": "integer",
              "minimum": 1
            },
            "rows": {
              "type": "array",
              "items": {
                "$ref": "#/$defs/row"
              }
            }
          }
        },
        "FACT_ROLE_CATALOG": {
          "type": "object",
          "required": [
            "version",
            "rows"
          ],
          "additionalProperties": false,
          "properties": {
            "version": {
              "type": "integer",
              "minimum": 1
            },
            "rows": {
              "type": "array",
              "items": {
                "$ref": "#/$defs/row"
              }
            }
          }
        },
        "CLUE_SOURCE_CATALOG": {
          "type": "object",
          "required": [
            "version",
            "rows"
          ],
          "additionalProperties": false,
          "properties": {
            "version": {
              "type": "integer",
              "minimum": 1
            },
            "rows": {
              "type": "array",
              "items": {
                "$ref": "#/$defs/row"
              }
            }
          }
        },
        "INTERACTION_INTENT_CATALOG": {
          "type": "object",
          "required": [
            "version",
            "rows"
          ],
          "additionalProperties": false,
          "properties": {
            "version": {
              "type": "integer",
              "minimum": 1
            },
            "rows": {
              "type": "array",
              "items": {
                "$ref": "#/$defs/row"
              }
            }
          }
        },
        "COMPLICATION_CATALOG": {
          "type": "object",
          "required": [
            "version",
            "rows"
          ],
          "additionalProperties": false,
          "properties": {
            "version": {
              "type": "integer",
              "minimum": 1
            },
            "rows": {
              "type": "array",
              "items": {
                "$ref": "#/$defs/row"
              }
            }
          }
        },
        "OPTIONAL_OPPORTUNITY_CATALOG": {
          "type": "object",
          "required": [
            "version",
            "rows"
          ],
          "additionalProperties": false,
          "properties": {
            "version": {
              "type": "integer",
              "minimum": 1
            },
            "rows": {
              "type": "array",
              "items": {
                "$ref": "#/$defs/row"
              }
            }
          }
        },
        "RECOVERY_ROLE_CATALOG": {
          "type": "object",
          "required": [
            "version",
            "rows"
          ],
          "additionalProperties": false,
          "properties": {
            "version": {
              "type": "integer",
              "minimum": 1
            },
            "rows": {
              "type": "array",
              "items": {
                "$ref": "#/$defs/row"
              }
            }
          }
        },
        "CONSEQUENCE_TYPE_CATALOG": {
          "type": "object",
          "required": [
            "version",
            "rows"
          ],
          "additionalProperties": false,
          "properties": {
            "version": {
              "type": "integer",
              "minimum": 1
            },
            "rows": {
              "type": "array",
              "items": {
                "$ref": "#/$defs/row"
              }
            }
          }
        },
        "ACT_AVAILABILITY": {
          "type": "object",
          "required": [
            "version",
            "rows"
          ],
          "additionalProperties": false,
          "properties": {
            "version": {
              "type": "integer",
              "minimum": 1
            },
            "rows": {
              "type": "array",
              "items": {
                "$ref": "#/$defs/row"
              }
            }
          }
        }
      }
    }
  },
  "$defs": {
    "row": {
      "type": "object",
      "required": [
        "id",
        "version",
        "label",
        "description",
        "weight",
        "support",
        "refs",
        "links",
        "requirements",
        "actAvailability"
      ],
      "additionalProperties": false,
      "properties": {
        "id": {
          "type": "string",
          "minLength": 1
        },
        "version": {
          "type": "integer",
          "minimum": 1
        },
        "label": {
          "type": "string",
          "minLength": 1
        },
        "description": {
          "type": "string"
        },
        "weight": {
          "type": "number",
          "exclusiveMinimum": 0
        },
        "support": {
          "enum": [
            "SUPPORTED",
            "UNRESOLVED"
          ]
        },
        "unavailableReason": {
          "type": "string",
          "minLength": 1
        },
        "refs": {
          "type": "array",
          "items": {
            "type": "object",
            "required": [
              "kind",
              "id"
            ],
            "additionalProperties": false,
            "properties": {
              "kind": {
                "type": "string",
                "minLength": 1
              },
              "id": {
                "type": "string",
                "minLength": 1
              }
            }
          },
          "uniqueItems": true
        },
        "links": {
          "type": "object",
          "additionalProperties": false,
          "properties": {
            "MISSION_HOOK_CATALOG": {
              "type": "array",
              "items": {
                "type": "string",
                "minLength": 1
              },
              "uniqueItems": true
            },
            "MISSION_PATTERN_CATALOG": {
              "type": "array",
              "items": {
                "type": "string",
                "minLength": 1
              },
              "uniqueItems": true
            },
            "STAGE_PURPOSE_CATALOG": {
              "type": "array",
              "items": {
                "type": "string",
                "minLength": 1
              },
              "uniqueItems": true
            },
            "ENVIRONMENT_ROLE_CATALOG": {
              "type": "array",
              "items": {
                "type": "string",
                "minLength": 1
              },
              "uniqueItems": true
            },
            "MISSION_ROLE_CATALOG": {
              "type": "array",
              "items": {
                "type": "string",
                "minLength": 1
              },
              "uniqueItems": true
            },
            "GENERIC_NPC_ROLE_CATALOG": {
              "type": "array",
              "items": {
                "type": "string",
                "minLength": 1
              },
              "uniqueItems": true
            },
            "INSTANCE_ROLE_CATALOG": {
              "type": "array",
              "items": {
                "type": "string",
                "minLength": 1
              },
              "uniqueItems": true
            },
            "INCIDENT_CATALOG": {
              "type": "array",
              "items": {
                "type": "string",
                "minLength": 1
              },
              "uniqueItems": true
            },
            "EVENT_CATALOG": {
              "type": "array",
              "items": {
                "type": "string",
                "minLength": 1
              },
              "uniqueItems": true
            },
            "FACT_ROLE_CATALOG": {
              "type": "array",
              "items": {
                "type": "string",
                "minLength": 1
              },
              "uniqueItems": true
            },
            "CLUE_SOURCE_CATALOG": {
              "type": "array",
              "items": {
                "type": "string",
                "minLength": 1
              },
              "uniqueItems": true
            },
            "INTERACTION_INTENT_CATALOG": {
              "type": "array",
              "items": {
                "type": "string",
                "minLength": 1
              },
              "uniqueItems": true
            },
            "COMPLICATION_CATALOG": {
              "type": "array",
              "items": {
                "type": "string",
                "minLength": 1
              },
              "uniqueItems": true
            },
            "OPTIONAL_OPPORTUNITY_CATALOG": {
              "type": "array",
              "items": {
                "type": "string",
                "minLength": 1
              },
              "uniqueItems": true
            },
            "RECOVERY_ROLE_CATALOG": {
              "type": "array",
              "items": {
                "type": "string",
                "minLength": 1
              },
              "uniqueItems": true
            },
            "CONSEQUENCE_TYPE_CATALOG": {
              "type": "array",
              "items": {
                "type": "string",
                "minLength": 1
              },
              "uniqueItems": true
            },
            "ACT_AVAILABILITY": {
              "type": "array",
              "items": {
                "type": "string",
                "minLength": 1
              },
              "uniqueItems": true
            }
          }
        },
        "requirements": {
          "type": "object",
          "additionalProperties": false,
          "properties": {
            "sourceTypes": {
              "type": "array",
              "items": {
                "type": "string",
                "minLength": 1
              },
              "uniqueItems": true
            },
            "realityFacts": {
              "type": "array",
              "items": {
                "type": "string",
                "minLength": 1
              },
              "uniqueItems": true
            },
            "knownFacts": {
              "type": "array",
              "items": {
                "type": "string",
                "minLength": 1
              },
              "uniqueItems": true
            },
            "roles": {
              "type": "array",
              "items": {
                "type": "string",
                "minLength": 1
              },
              "uniqueItems": true
            },
            "realityTheories": {
              "type": "array",
              "items": {
                "type": "string",
                "minLength": 1
              },
              "uniqueItems": true
            }
          }
        },
        "actAvailability": {
          "type": "object",
          "required": [
            "*"
          ],
          "additionalProperties": {
            "enum": [
              "AVAILABLE",
              "PREFERRED",
              "RESTRICTED",
              "FORBIDDEN"
            ]
          }
        }
      },
      "allOf": [
        {
          "if": {
            "properties": {
              "support": {
                "const": "UNRESOLVED"
              }
            }
          },
          "then": {
            "required": [
              "unavailableReason"
            ]
          }
        }
      ]
    }
  }
}
