{
  "format": "mission-author-catalogs-1",
  "id": "MISSING_OPERATIVE_AUTHORING_PROOF",
  "version": 4,
  "catalogs": {
    "MISSION_HOOK_CATALOG": {
      "version": 1,
      "rows": [
        {
          "id": "MISSING_PERSON",
          "version": 1,
          "label": "Missing person",
          "description": "Authored loss of contact requests investigation or evacuation.",
          "weight": 1,
          "support": "SUPPORTED",
          "refs": [
            {
              "kind": "instanceArchetype",
              "id": "npc_undercover_operative"
            }
          ],
          "links": {
            "MISSION_PATTERN_CATALOG": [
              "LOCATE_EVACUATE",
              "INVESTIGATE"
            ]
          },
          "requirements": {
            "sourceTypes": [
              "HAVEN_REQUEST"
            ],
            "realityFacts": [
              "operative-communications-stopped"
            ],
            "knownFacts": [
              "allied-operative-embedded-here"
            ],
            "roles": [
              "SUBJECT"
            ]
          },
          "actAvailability": {
            "*": "AVAILABLE"
          }
        },
        {
          "id": "ARTIFACT_REPORT",
          "version": 1,
          "label": "Artifact report",
          "description": "A characterized local object offers a recovery lead; its true identity is not automatically known.",
          "weight": 1,
          "support": "SUPPORTED",
          "refs": [
            {
              "kind": "item",
              "id": "ASGARD_EM_RIFLE"
            }
          ],
          "links": {
            "MISSION_PATTERN_CATALOG": [
              "RECOVER"
            ]
          },
          "requirements": {
            "knownFacts": [
              "lab-device-characterized"
            ],
            "roles": [
              "RECOVERY_OBJECT"
            ]
          },
          "actAvailability": {
            "*": "AVAILABLE"
          }
        },
        {
          "id": "MEDICAL_OUTBREAK",
          "version": 1,
          "label": "Medical outbreak",
          "description": "Reserved hook; clinical Theory/curriculum guidance is missing from the executable import.",
          "weight": 1,
          "support": "UNRESOLVED",
          "refs": [],
          "links": {},
          "requirements": {},
          "actAvailability": {
            "*": "AVAILABLE"
          },
          "unavailableReason": "No executable medical Theory/curriculum adapter for general outbreak composition."
        }
      ]
    },
    "MISSION_PATTERN_CATALOG": {
      "version": 1,
      "rows": [
        {
          "id": "LOCATE_EVACUATE",
          "version": 1,
          "label": "Locate Evacuate",
          "description": "Structural objective grammar only; no exact rooms, dialogue, Recipes or thresholds.",
          "weight": 1,
          "support": "SUPPORTED",
          "refs": [],
          "links": {
            "MISSION_ROLE_CATALOG": [
              "SUBJECT"
            ],
            "FACT_ROLE_CATALOG": [
              "SUBJECT_LOCATION"
            ]
          },
          "requirements": {
            "roles": [
              "SUBJECT"
            ]
          },
          "actAvailability": {
            "*": "AVAILABLE"
          }
        },
        {
          "id": "INVESTIGATE",
          "version": 1,
          "label": "Investigate",
          "description": "Structural objective grammar only; no exact rooms, dialogue, Recipes or thresholds.",
          "weight": 1,
          "support": "SUPPORTED",
          "refs": [],
          "links": {
            "MISSION_ROLE_CATALOG": [
              "SUBJECT",
              "EVIDENCE_SOURCE"
            ],
            "FACT_ROLE_CATALOG": [
              "SUBJECT_LOCATION"
            ]
          },
          "requirements": {
            "roles": [
              "SUBJECT",
              "EVIDENCE_SOURCE"
            ]
          },
          "actAvailability": {
            "*": "AVAILABLE"
          }
        },
        {
          "id": "RECOVER",
          "version": 1,
          "label": "Recover",
          "description": "Structural objective grammar only; no exact rooms, dialogue, Recipes or thresholds.",
          "weight": 1,
          "support": "SUPPORTED",
          "refs": [],
          "links": {
            "MISSION_ROLE_CATALOG": [
              "RECOVERY_OBJECT"
            ],
            "FACT_ROLE_CATALOG": [
              "DEVICE_PURPOSE"
            ]
          },
          "requirements": {
            "roles": [
              "RECOVERY_OBJECT"
            ]
          },
          "actAvailability": {
            "*": "AVAILABLE"
          }
        },
        {
          "id": "ASSIST_STABILIZE",
          "version": 1,
          "label": "Assist Stabilize",
          "description": "Reserved structural vocabulary pending reference-backed proof content.",
          "weight": 1,
          "support": "UNRESOLVED",
          "refs": [],
          "links": {},
          "requirements": {},
          "actAvailability": {
            "*": "AVAILABLE"
          },
          "unavailableReason": "No validated objective composition template in this proof pack."
        },
        {
          "id": "CONTACT_NEGOTIATE",
          "version": 1,
          "label": "Contact Negotiate",
          "description": "Reserved structural vocabulary pending reference-backed proof content.",
          "weight": 1,
          "support": "UNRESOLVED",
          "refs": [],
          "links": {},
          "requirements": {},
          "actAvailability": {
            "*": "AVAILABLE"
          },
          "unavailableReason": "No validated objective composition template in this proof pack."
        }
      ]
    },
    "STAGE_PURPOSE_CATALOG": {
      "version": 2,
      "rows": [
        {
          "id": "ARRIVAL",
          "version": 2,
          "label": "Arrival",
          "description": "Stage purpose chosen before physical environment.",
          "weight": 1,
          "support": "SUPPORTED",
          "refs": [
            {
              "kind": "stageArchetype",
              "id": "stage_gate_area"
            }
          ],
          "links": {},
          "requirements": {},
          "actAvailability": {
            "*": "AVAILABLE"
          }
        },
        {
          "id": "TRANSIT",
          "version": 2,
          "label": "Transit",
          "description": "Stage purpose chosen before physical environment.",
          "weight": 1,
          "support": "SUPPORTED",
          "refs": [
            {
              "kind": "stageArchetype",
              "id": "stage_room_basic"
            },
            {
              "kind": "stageArchetype",
              "id": "stage_hallway_basic"
            },
            {
              "kind": "stageArchetype",
              "id": "stage_processing_room"
            }
          ],
          "links": {},
          "requirements": {},
          "actAvailability": {
            "*": "AVAILABLE"
          }
        },
        {
          "id": "PRIMARY_SUBJECT",
          "version": 2,
          "label": "Primary Subject",
          "description": "Stage purpose chosen before physical environment.",
          "weight": 1,
          "support": "SUPPORTED",
          "refs": [
            {
              "kind": "stageArchetype",
              "id": "stage_medical_holding"
            },
            {
              "kind": "stageArchetype",
              "id": "stage_processing_room"
            },
            {
              "kind": "stageArchetype",
              "id": "stage_hallway_basic"
            },
            {
              "kind": "stageArchetype",
              "id": "stage_room_basic"
            }
          ],
          "links": {},
          "requirements": {},
          "actAvailability": {
            "*": "AVAILABLE"
          }
        },
        {
          "id": "SUPPORTING_CLUE",
          "version": 2,
          "label": "Supporting Clue",
          "description": "Stage purpose chosen before physical environment.",
          "weight": 1,
          "support": "SUPPORTED",
          "refs": [
            {
              "kind": "stageArchetype",
              "id": "stage_medical_holding"
            },
            {
              "kind": "stageArchetype",
              "id": "stage_security_room"
            },
            {
              "kind": "stageArchetype",
              "id": "stage_processing_room"
            },
            {
              "kind": "stageArchetype",
              "id": "stage_room_basic"
            },
            {
              "kind": "stageArchetype",
              "id": "stage_hallway_basic"
            }
          ],
          "links": {},
          "requirements": {},
          "actAvailability": {
            "*": "AVAILABLE"
          }
        },
        {
          "id": "OPTIONAL_RECOVERY",
          "version": 2,
          "label": "Optional Recovery",
          "description": "Stage purpose chosen before physical environment.",
          "weight": 1,
          "support": "SUPPORTED",
          "refs": [
            {
              "kind": "stageArchetype",
              "id": "stage_processing_room"
            },
            {
              "kind": "stageArchetype",
              "id": "stage_security_room"
            },
            {
              "kind": "stageArchetype",
              "id": "stage_room_basic"
            }
          ],
          "links": {},
          "requirements": {},
          "actAvailability": {
            "*": "AVAILABLE"
          }
        },
        {
          "id": "EXIT_ROUTE",
          "version": 2,
          "label": "Exit Route",
          "description": "Stage purpose chosen before physical environment.",
          "weight": 1,
          "support": "SUPPORTED",
          "refs": [
            {
              "kind": "stageArchetype",
              "id": "stage_gate_area"
            },